{
  "$schema": "./state.schema.json",
  "schema_version": "1.0.0",
  "project": {
    "name": "heso",
    "tagline": "headless browser for the agent-relevant half of the web",
    "category": "agentware",
    "phase": "M0-skeleton"
  },
  "meta": {
    "updated_at": "2026-05-18T09:30:00Z",
    "updated_by": "claude-opus-4-7"
  },
  "current_focus": {
    "milestone_id": "M1",
    "summary": "ADR 0014 Phase 1A landed 2026-05-18: heso-engine-js wraps QuickJS via rquickjs as a sandboxed JS evaluator (no DOM yet) with console capture, per-engine isolation, 16 unit tests, `heso eval-js` CLI subcommand. Workspace now 8 crates (added heso-engine-js); 145 lib tests green; 8.1 MB release binary (up from 5.2 MB pre-QuickJS). Engine layering settled: heso-engine-fetch is the static path (ADR 0012), heso-engine-js is the JS path (ADR 0014). Cartography V0 also live (ADR 0015): `heso open --explore-links` builds same-origin sub-page maps, content-addressed plat_hash (BLAKE3 over canonical JSON), `heso plat-verify` catches tampering. Strategic priorities: (1) ADR 0014 Phase 1B — agent-shaped DOM types as #[rquickjs::class] backed by scraper::Html (Document/Element/Node/NodeList/Text + window/document globals); (2) Phase 1C — run <script> tags during `heso open --js`; (3) round out remaining primitives per ADR 0010; (4) T-022 planner v0; (5) T-023 wire heso.run.",
    "next_action_id": "T-022"
  },
  "milestones": [
    {
      "id": "M0",
      "title": "Skeleton",
      "status": "in_progress",
      "target_date": "2026-05-31",
      "exit_criteria": [
        "`cargo check --workspace` passes",
        "AGENTS.md + .agent/ populated and discoverable by any coding agent",
        "Foundational ADRs (0001–0009) written and accepted",
        "Research wiki populated: rust-llm-mistakes + browser-engines (rendering, agent-first, conversion, ladybird, determinism) + servo-internals (architecture, embedding-api, spidermonkey, verso). MCP ecosystem + existing-agent-browsers still pending.",
        "research/INDEX.md exists and indexes every note",
        ".agent/HOWTO/use-research.md describes the wiki workflow",
        "docs/the-one-tool.md and skills/heso/SKILL.md drafted (per ADR 0009)",
        "state.json validates against state.schema.json",
        "Initial git history + GitHub repo created"
      ]
    },
    {
      "id": "M1",
      "title": "Native fetch engine running (per ADR 0012)",
      "status": "achieved",
      "target_date": null,
      "exit_criteria": [
        "reqwest + scraper + ego-tree added to workspace; chromiumoxide + futures removed",
        "heso-engine-fetch crate created; implements EngineApi via reqwest::Client + scraper::Html parse + recursive DOM walker that strips script/style/noscript/template",
        "EngineApi reshaped to async (impl Future + Send) — done in the 0011 → 0012 transition, kept",
        "FetchPage holds the post-redirect URL + pre-computed visible body text",
        "`heso fetch <url>` returns {url, text} JSON; `heso run <url> <req>` returns a Receipt with a stable BLAKE3 trace_hash",
        "Live network test passes (example.com extracts 'Example Domain'); Flue agent end-to-end produces detailed answer about korrd.co from real page content",
        "Single Rust binary, no Chrome dep, no Node — release build ~30s on cold cache, ~10MB stripped",
        "Determinism preconditions still pending — but the static-fetch path has no clock/RNG to seed, so deterministic-mode is free for this engine"
      ]
    },
    {
      "id": "M2",
      "title": "Primitives + trace runner",
      "status": "todo",
      "target_date": null,
      "exit_criteria": [
        "Primitives layer (heso-primitives crate) exposes the 15 terminal-shaped internal operations from ADR 0010: pwd, ls, cd, cat, find, grep, echo, rm, click, submit, wget, wait, screenshot, eval, diff. Each is implemented over EngineApi and returns a typed Result. Cookies and Web Storage are addressed via the /env/ virtual hierarchy (cat /env/cookie/<name>, echo val > /env/storage/local/<key>, etc.) — not separate primitives.",
        "Trace runner (heso-trace-exec crate) takes [PrimitiveOp] + EngineApi + SessionConfig, runs primitives in order, produces Result + Receipt.",
        "Trace format types (heso-trace crate) defined as JSON-serializable AST — the canonical form for signing and replay.",
        "Fake clock implementation (Date.now, performance.now, setTimeout, setInterval, requestAnimationFrame) — per ADR 0008",
        "Seeded RNG implementation (Math.random + crypto.getRandomValues with explicit opt-out) — per ADR 0008",
        "Network record/replay layer via WebViewDelegate::intercept_web_resource_load — per ADR 0008",
        "Three operating modes (deterministic / recording / live) wired into session config",
        "Same-seed determinism smoke test: two runs of the same hand-written trace in deterministic mode produce byte-identical Receipt for at least 5 reference sites"
      ]
    },
    {
      "id": "M3",
      "title": "The one tool (planner + heso.run)",
      "status": "todo",
      "target_date": null,
      "exit_criteria": [
        "Planner v0 (heso-planner crate) takes (start_url, plain-English request, current page state) → [PrimitiveOp]. v0 is pattern-matched, covering 5 request shapes: list extraction, single-item search, form submission, multi-page join, page watch. Returns a Need-Clarification response when the request is too ambiguous.",
        "heso.run wired as a single MCP tool (heso-mcp crate) exposing the contract from ADR 0009: (start_url, request, options?) → (status, data, receipt, cost).",
        "skills/heso/SKILL.md + docs/the-one-tool.md polished from real usage. SKILL.md is the only artifact agents read to learn heso.",
        "End-to-end demo: heso.run works for 5 representative requests against live web pages (HN headline scrape, Wikipedia extract, a search-and-filter, a multi-page join, a form-submission flow). Each call returns expected data + a signed receipt + cost report.",
        "Planner version is recorded in every receipt; same input + same planner_id + same seed produces byte-identical output."
      ]
    },
    {
      "id": "M4",
      "title": "Identity + signed audit log (precondition: M2 determinism + M3 trace runner)",
      "status": "todo",
      "target_date": null,
      "exit_criteria": [
        "Ed25519 keypair per agent instance, stored in ~/.heso/identity/",
        "Every heso.run call produces a Receipt signed by the session's identity key",
        "Append-only audit log on disk, signature-chained (git-style)",
        "Audit log entries include session seed + network-record hash + planner_id so they verify reproducibility per ADR 0008",
        "Live mode refuses to sign actions (no determinism guarantee)",
        "`heso log --verify` CLI command validates the entire log AND replays each trace deterministically"
      ]
    },
    {
      "id": "M5",
      "title": "Claude Code plugin published",
      "status": "todo",
      "target_date": null,
      "exit_criteria": [
        "Plugin bundles: heso MCP server (exposing the one tool heso.run), skills/heso/SKILL.md, a web-researcher subagent that uses heso, PostToolUse hook for receipt verification",
        "Published to a marketplace (official or own)",
        "Working end-to-end demo: research a topic across 20 sources in one command",
        "Landing page + 60-second demo video"
      ]
    }
  ],
  "tasks": [
    {
      "id": "T-001",
      "title": "Initialize Cargo workspace + root config (Cargo.toml, rust-toolchain, fmt, clippy, deny)",
      "status": "done",
      "priority": "P0",
      "milestone": "M0",
      "owner": "claude",
      "created_at": "2026-05-17",
      "updated_at": "2026-05-17",
      "depends_on": [],
      "links": {
        "adr": [
          "0001"
        ],
        "research": [],
        "files": [
          "Cargo.toml",
          "rust-toolchain.toml",
          "rustfmt.toml",
          "clippy.toml",
          "deny.toml"
        ],
        "issues": [],
        "rfcs": []
      },
      "notes": ""
    },
    {
      "id": "T-002",
      "title": "Write AGENTS.md, CLAUDE.md, README.md, and the .agent/ meta directory",
      "status": "done",
      "priority": "P0",
      "milestone": "M0",
      "owner": "claude",
      "created_at": "2026-05-17",
      "updated_at": "2026-05-17",
      "depends_on": [],
      "links": {
        "adr": [
          "0007"
        ],
        "research": [],
        "files": [
          "AGENTS.md",
          "CLAUDE.md",
          "README.md",
          ".agent/MAP.md",
          ".agent/CONVENTIONS.md",
          ".agent/WORKFLOWS.md",
          ".agent/PRIORITIES.md",
          ".agent/GLOSSARY.md"
        ],
        "issues": [],
        "rfcs": []
      },
      "notes": ""
    },
    {
      "id": "T-003",
      "title": "Write foundational ADRs (0001–0009)",
      "status": "done",
      "priority": "P0",
      "milestone": "M0",
      "owner": "claude",
      "created_at": "2026-05-17",
      "updated_at": "2026-05-17",
      "depends_on": [],
      "links": {
        "adr": [
          "0001",
          "0002",
          "0003",
          "0004",
          "0005",
          "0006",
          "0007",
          "0008",
          "0009"
        ],
        "research": [],
        "files": [
          "decisions/"
        ],
        "issues": [],
        "rfcs": []
      },
      "notes": "ADR 0008 (deterministic execution) added as first-class property. ADR 0009 (heso.run as the single agent-facing tool) locks the public surface — all previously-designed primitives become internals."
    },
    {
      "id": "T-004",
      "title": "Create heso-core + heso-engine-api + heso-cli crate skeletons",
      "status": "done",
      "priority": "P0",
      "milestone": "M0",
      "owner": "claude",
      "created_at": "2026-05-17",
      "updated_at": "2026-05-17",
      "depends_on": [
        "T-001"